{
  "$schema": "https://json-schema.org/draft/2020-12/schema",
  "$id": "https://traceknot.kyungho.info/schemas/capability.v2.json",
  "title": "Traceknot host capability v2",
  "type": "object",
  "additionalProperties": false,
  "required": ["schemaVersion", "host", "adapterVersion", "capabilities"],
  "properties": {
    "schemaVersion": { "const": "quality-capability/v2" },
    "host": { "type": "string", "minLength": 1 },
    "adapterVersion": { "type": "string", "minLength": 1 },
    "capabilities": {
      "anyOf": [
        { "$ref": "#/$defs/capabilityModel" },
        { "$ref": "#/$defs/legacyCapabilityModel" }
      ]
    },
    "limitations": { "type": "array", "items": { "type": "string", "minLength": 1 }, "uniqueItems": true }
  },
  "$defs": {
    "capabilityModel": {
      "$schema": "https://json-schema.org/draft/2020-12/schema",
      "$id": "https://traceknot.kyungho.info/schemas/capability-model.v1.json",
      "title": "Traceknot shared host capability set",
      "type": "object",
      "additionalProperties": false,
      "required": [
        "executeCommands",
        "executeBrowser",
        "captureArtifacts",
        "bindSnapshot",
        "provideIndependentEvidence",
        "persistEvidence",
        "approveExceptions",
        "isolatedReadOnlyReview",
        "enforcedStructuredOutput"
      ],
      "properties": {
        "executeCommands": { "type": "boolean" },
        "executeBrowser": { "type": "boolean" },
        "captureArtifacts": { "type": "boolean" },
        "bindSnapshot": { "type": "boolean" },
        "provideIndependentEvidence": { "type": "boolean" },
        "persistEvidence": { "type": "boolean" },
        "approveExceptions": { "type": "boolean" },
        "isolatedReadOnlyReview": { "type": "boolean" },
        "enforcedStructuredOutput": { "type": "boolean" },
        "enforceSkillOriginEgressDeny": { "const": false }
      }
    },
    "legacyCapabilityModel": {
      "$schema": "https://json-schema.org/draft/2020-12/schema",
      "title": "Traceknot legacy host capability set",
      "type": "object",
      "additionalProperties": false,
      "required": [
        "executeCommands",
        "executeBrowser",
        "captureArtifacts",
        "bindSnapshot",
        "provideIndependentEvidence",
        "persistEvidence",
        "approveExceptions",
        "isolatedReadOnlyReview",
        "enforcedStructuredOutput"
      ],
      "properties": {
        "executeCommands": { "type": "boolean" },
        "executeBrowser": { "type": "boolean" },
        "captureArtifacts": { "type": "boolean" },
        "bindSnapshot": { "type": "boolean" },
        "provideIndependentEvidence": { "type": "boolean" },
        "persistEvidence": { "type": "boolean" },
        "approveExceptions": { "type": "boolean" },
        "isolatedReadOnlyReview": { "type": "boolean" },
        "enforcedStructuredOutput": { "type": "boolean" }
      }
    }
  }
}
